[
  {
    "id": "01KBJXFP7WMDKNJ8HNMBW1CZZG",
    "name": "Swedish FireSteel 2.0",
    "category": "fire",
    "brand": "Light My Fire",
    "model": "Swedish FireSteel 2.0",
    "description": "Krzesiwo ferrocerowe, niezawodne w trudnych warunkach",
    "price_tier": "medium",
    "quality": "high",
    "weight": 50,
    "weight_unit": "g",
    "url": "https://lightmyfire.com/products/swedish-firesteel",
    "image_filename": "light_my_fire_firesteel_2.0.jpg",
    "shops": [
      {
        "url": "https://militaria.pl/p/krzesiwo-light-my-fire-firesteel-2-0-bioscout-cocoshell-151419",
        "price": 54.95,
        "currency": "PLN",
        "updated_at": "2025-12-10"
      },
      {
        "url": "https://militaria.pl/p/krzesiwo-light-my-fire-firesteel-2-0-bio-army-orange-62624",
        "price": 74.95,
        "currency": "PLN",
        "updated_at": "2025-12-10"
      },
      {
        "url": "https://militaria.pl/p/krzesiwo-light-my-fire-firesteel-2-0-bio-army-z-gwizdkiem-black-43447",
        "variant": "Black",
        "price": 74.95,
        "currency": "PLN",
        "updated_at": "2025-12-10"
      }
    ]
  },
  {
    "id": "01KBJXGQ87FGHRFQTVMP3YFSNG",
    "name": "BIC Classic Lighter",
    "category": "fire",
    "brand": "BIC",
    "model": "Classic",
    "description": "Prosta i tania zapalniczka jednorazowa",
    "price_tier": "low",
    "quality": "medium",
    "weight": 21,
    "weight_unit": "g",
    "url": "https://www.bicworld.com/en/products/details/1/bic-lighter",
    "shops": [
      {
        "url": "https://militaria.pl/p/kurtka-military-wear-m65-classic-wz-93-pantera-pl-woodland-2794137",
        "price": 329,
        "currency": "PLN",
        "updated_at": "2025-12-10"
      },
      {
        "url": "https://militaria.pl/p/kurtka-brandit-m65-classic-olive-98640",
        "variant": "Olive",
        "price": 299,
        "currency": "PLN",
        "updated_at": "2025-12-10"
      },
      {
        "url": "https://militaria.pl/p/kurtka-brandit-m65-classic-black-98639",
        "variant": "Black",
        "price": 299,
        "currency": "PLN",
        "updated_at": "2025-12-10"
      }
    ]
  },
  {
    "id": "01KBJXH29HTYHNAD2QHR4VQ0H7",
    "name": "Fiskars X7",
    "category": "tools",
    "brand": "Fiskars",
    "model": "X7",
    "description": "Lekka, kompaktowa siekierka turystyczna / survivalowa",
    "price_tier": "low",
    "quality": "medium",
    "weight": 645,
    "weight_unit": "g",
    "url": "https://www.fiskars.com/en-us/gardening-and-yard-care/products/axes-mauls-and-machetes/x7-hatchet-14-378501-1005",
    "image_filename": "fiskars-x7.png",
    "shops": [
      {
        "url": "https://militaria.pl/p/zestaw-wiley-x-vapor-comm-shooting-range-kit-2849983"
      }
    ]
  },
  {
    "id": "01KBJXH4VP0T1SAZADHD3KY0RY",
    "name": "Leatherman Wave+",
    "category": "tools",
    "brand": "Leatherman",
    "model": "Wave+",
    "description": "Uniwersalny multitool klasy premium",
    "price_tier": "high",
    "quality": "high",
    "weight": 8.5,
    "weight_unit": "oz",
    "url": "https://www.leatherman.com/",
    "image_filename": "leatherman-wave-plus.png",
    "shops": [
      {
        "url": "https://militaria.pl/p/multitool-leatherman-wave-plus-z-kabura-23574"
      },
      {
        "url": "https://militaria.pl/p/multitool-leatherman-wave-plus-polish-army-z-kabura-35440"
      },
      {
        "url": "https://militaria.pl/p/multitool-leatherman-wave-plus-black-z-kabura-23575"
      }
    ]
  },
  {
    "id": "01KBJXH7904T9DT153977RWERA",
    "name": "Leatherman Blast",
    "category": "tools",
    "brand": "Leatherman",
    "model": "Blast",
    "description": "Solidny multitool z pełnym zestawem narzędzi",
    "price_tier": "medium",
    "quality": "high",
    "weight": 6.9,
    "weight_unit": "oz",
    "url": "https://www.leatherman.com/",
    "image_filename": "leatherman-blast.png",
    "shops": []
  },
  {
    "id": "01KBJXHA4CVVWZJRSWDJ19F85C",
    "name": "Gerber E-Tool Folding Shovel",
    "category": "tools",
    "brand": "Gerber",
    "model": "E-Tool Folding Shovel",
    "description": "Składana saperka terenowa",
    "price_tier": "medium",
    "quality": "high",
    "weight": 0,
    "weight_unit": "g",
    "url": "https://www.gerbergear.com/",
    "image_filename": "gerber-folding-spade.png",
    "shops": []
  },
  {
    "id": "01KBJXHCCSSKZWDFR4AB4H5DCV",
    "name": "Paracord Mil-Tec Commando 5 mm x 15 m - Olive",
    "category": "tools",
    "brand": "Mil-Tec",
    "model": "Commando 5 mm x 15 m",
    "description": "Uniwersalna linka ratunkowa / survivalowa o wytrzymałości do 220 kg",
    "price_tier": "medium",
    "quality": "medium",
    "weight": 0,
    "weight_unit": "g",
    "shops": [
      {
        "url": "https://militaria.pl/p/linka-mil-tec-commando-5-mm-x-15-m-olive-67413",
        "variant": "olive",
        "price": 19.99,
        "currency": "PLN",
        "updated_at": "2025-12-10"
      },
      {
        "url": "https://militaria.pl/p/linka-mil-tec-commando-5-mm-x-15-m-black-57957",
        "variant": "black",
        "price": 19.99,
        "currency": "PLN",
        "updated_at": "2025-12-10"
      }
    ]
  },
  {
    "id": "01KBJXHEW5ECFZVXQFB4E539E5",
    "name": "Paracord Badger Outdoor 500 30m - Olive",
    "category": "tools",
    "brand": "Badger Outdoor",
    "model": "Paracord 550",
    "description": "Linka paracord 550 o długości 30 metrów i średnicy 5 mm, wykonana z odpornego na uszkodzenia nylonu i wyposażona w 7 rdzeni.",
    "price_tier": "medium",
    "quality": "medium",
    "weight": 0,
    "weight_unit": "g",
    "shops": [
      {
        "url": "https://militaria.pl/p/linka-spadochronowa-paracord-badger-outdoor-550-30-m-olive-18082",
        "variant": "olive",
        "price": 29.99,
        "currency": "PLN",
        "updated_at": "2025-12-10"
      },
      {
        "url": "https://militaria.pl/p/linka-spadochronowa-paracord-badger-outdoor-550-30-m-black-18080",
        "variant": "black",
        "price": 29.99,
        "currency": "PLN",
        "updated_at": "2025-12-10"
      }
    ]
  },
  {
    "id": "01KBJXHH4WF4NYD9HD3P955H9H",
    "name": "Gorilla Tape",
    "category": "tools",
    "brand": "Gorilla Tape",
    "model": "Gorilla Tape Standard",
    "description": "Uniwersalna, mocna taśma naprawcza do terenu",
    "price_tier": "low",
    "quality": "high",
    "weight": 0,
    "weight_unit": "g",
    "url": "https://www.gorillatough.com/product/gorilla-tape/",
    "image_filename": "gorilla-tape.png",
    "shops": []
  },
  {
    "id": "01KBJXHKTWG3VFP9WR006129C0",
    "name": "BAHCO 396-LAP",
    "category": "tools",
    "brand": "BAHCO",
    "model": "396-LAP",
    "description": "Składana piła ręczna, idealna do cięcia drewna w terenie",
    "price_tier": "medium",
    "quality": "high",
    "weight": 200,
    "weight_unit": "g",
    "url": "https://www.bahco.com/",
    "image_filename": "bahco-laplander.jpg.png",
    "shops": []
  },
  {
    "id": "01KBJXHP7289P4VEDKSCAMYBJW",
    "name": "Victorinox Ranger",
    "category": "tools",
    "brand": "Victorinox",
    "model": "Ranger",
    "description": "Szwajcarski scyzoryk z wieloma funkcjami, idealny do outdoor",
    "price_tier": "medium",
    "quality": "high",
    "weight": 118,
    "weight_unit": "g",
    "url": "https://www.victorinox.com/global/en/products/Swiss-Army-Knives/Medium-Pocket-Knives/Ranger/p/1.3713",
    "image_filename": "Victorinox-Ranger.png",
    "shops": [
      {
        "url": "https://militaria.pl/p/scyzoryk-victorinox-ranger-red-64893?pref_q=scyzoryk+victorinox+ranger+red",
        "variant": "red",
        "price": 249,
        "currency": "PLN",
        "updated_at": "2025-12-10"
      }
    ]
  },
  {
    "id": "01KBJXHRQ0NKA5QAGHHC41YE4A",
    "name": "Victorinox Alox Bantam - Silver",
    "category": "tools",
    "brand": "Victorinox",
    "model": "Alox Bantam - Silver",
    "description": "Ultra-kompaktowy scyzoryk w aluminiowej obudowie",
    "price_tier": "low",
    "quality": "high",
    "weight": 29,
    "weight_unit": "g",
    "url": "https://www.victorinox.com/global/en/products/Swiss-Army-Knives/Small-Pocket-Knives/Alox-Bantam/p/0.6221",
    "image_filename": "Victorinox-Alox-Bantam-Silver.png",
    "shops": [
      {
        "url": "https://militaria.pl/p/scyzoryk-victorinox-alox-bantam-silver-2608760",
        "price": 119.99,
        "currency": "PLN",
        "updated_at": "2025-12-10"
      }
    ]
  },
  {
    "id": "01KBJXHWAA2WJPCWEWDQ1HMZ38",
    "name": "Sawyer Mini",
    "category": "water",
    "brand": "Sawyer",
    "model": "Mini",
    "description": "Kompaktowy filtr do wody, łatwy w transporcie",
    "price_tier": "low",
    "quality": "medium",
    "weight": 2,
    "weight_unit": "oz",
    "url": "https://sawyer.com/products/mini-water-filtration-system",
    "image_filename": "sawyer-mini.png",
    "shops": [
      {
        "url": "https://militaria.pl/p/filtr-do-wody-sawyer-mini-blue-20615?pref_q=filtr+do+wody+sawyer+mini+-+blue"
      }
    ]
  },
  {
    "id": "01KBJXHYQ826J0HKQ21CK8CR6H",
    "name": "Sawyer Squeeze",
    "category": "water",
    "brand": "Sawyer",
    "model": "Squeeze",
    "description": "Wydajny filtr do zastosowań outdoor",
    "price_tier": "medium",
    "quality": "high",
    "weight": 3,
    "weight_unit": "oz",
    "url": "https://sawyer.com/products/squeeze-water-filtration-system",
    "image_filename": "sawyer-squeeze-sp129.png",
    "shops": [
      {
        "url": "https://militaria.pl/p/filtr-do-wody-sawyer-squeeze-water-filtration-system-2687278",
        "price": 350,
        "currency": "PLN",
        "updated_at": "2025-12-10"
      },
      {
        "url": "https://militaria.pl/p/filtr-do-wody-sawyer-point-one-micro-squeeze-36793",
        "price": 289,
        "currency": "PLN",
        "updated_at": "2025-12-10"
      }
    ]
  },
  {
    "id": "01KBJXJ16F5J1NYW6GZN2S906E",
    "name": "Katadyn BeFree 3L",